{
  "after": {
    "name": "after.blend",
    "sha256": "d01e225e02c5509aef1b772e63464ad918cb95d739ce4fadce62ee143b11fd19"
  },
  "ambiguity": [
    {
      "after": "object:00012",
      "before": "object:00015",
      "evidence": [
        "same geometry",
        "same topology",
        "same context",
        "same materials"
      ]
    },
    {
      "after": "object:00013",
      "before": "object:00015",
      "evidence": [
        "same geometry",
        "same topology",
        "same context",
        "same materials"
      ]
    },
    {
      "after": "object:00012",
      "before": "object:00016",
      "evidence": [
        "same geometry",
        "same topology",
        "same context",
        "same materials"
      ]
    },
    {
      "after": "object:00013",
      "before": "object:00016",
      "evidence": [
        "same geometry",
        "same topology",
        "same context",
        "same materials"
      ]
    }
  ],
  "before": {
    "name": "before.blend",
    "sha256": "c2bc989d0f5957d344ea76867ac09f4139db333378988f56f8fc170cb480224a"
  },
  "context": {
    "after": {
      "autoexec_disabled": true,
      "external_resources_fingerprinted": false,
      "frame": 1,
      "libraries": [],
      "scene": "Scene",
      "unit_scale": 0.01,
      "units": "METRIC",
      "view_layer": "ViewLayer"
    },
    "before": {
      "autoexec_disabled": true,
      "external_resources_fingerprinted": false,
      "frame": 1,
      "libraries": [],
      "scene": "Scene",
      "unit_scale": 0.01,
      "units": "METRIC",
      "view_layer": "ViewLayer"
    }
  },
  "correspondences": [
    {
      "after": "collection:00000",
      "before": "collection:00000",
      "confidence": "strong inferred",
      "evidence": [
        "same name (not proof of identity)",
        "same context"
      ],
      "method": "mutual-best-margin"
    },
    {
      "after": "collection:00001",
      "before": "collection:00001",
      "confidence": "strong inferred",
      "evidence": [
        "same name (not proof of identity)",
        "same context"
      ],
      "method": "mutual-best-margin"
    },
    {
      "after": "collection:00002",
      "before": "collection:00002",
      "confidence": "strong inferred",
      "evidence": [
        "same name (not proof of identity)",
        "same context"
      ],
      "method": "mutual-best-margin"
    },
    {
      "after": "object:00000",
      "before": "object:00000",
      "confidence": "strong inferred",
      "evidence": [
        "same name (not proof of identity)",
        "same data",
        "same context",
        "same spatial transform"
      ],
      "method": "mutual-best-margin"
    },
    {
      "after": "object:00001",
      "before": "object:00001",
      "confidence": "strong inferred",
      "evidence": [
        "same name (not proof of identity)",
        "same geometry",
        "same topology",
        "same data",
        "same context",
        "same materials",
        "same spatial transform"
      ],
      "method": "mutual-best-margin"
    },
    {
      "after": "object:00002",
      "before": "object:00002",
      "confidence": "strong inferred",
      "evidence": [
        "same name (not proof of identity)",
        "same geometry",
        "same topology",
        "same data",
        "same context",
        "same materials",
        "same spatial transform"
      ],
      "method": "mutual-best-margin"
    },
    {
      "after": "object:00003",
      "before": "object:00003",
      "confidence": "strong inferred",
      "evidence": [
        "same name (not proof of identity)",
        "same geometry",
        "same topology",
        "same data",
        "same context",
        "same materials",
        "same spatial transform"
      ],
      "method": "mutual-best-margin"
    },
    {
      "after": "object:00004",
      "before": "object:00004",
      "confidence": "strong inferred",
      "evidence": [
        "same name (not proof of identity)",
        "same geometry",
        "same topology",
        "same data",
        "same context",
        "same materials",
        "same spatial transform"
      ],
      "method": "mutual-best-margin"
    },
    {
      "after": "object:00005",
      "before": "object:00005",
      "confidence": "strong inferred",
      "evidence": [
        "same name (not proof of identity)",
        "same geometry",
        "same topology",
        "same data",
        "same context",
        "same materials",
        "same spatial transform"
      ],
      "method": "mutual-best-margin"
    },
    {
      "after": "object:00010",
      "before": "object:00006",
      "confidence": "probable rename",
      "evidence": [
        "same geometry",
        "same topology",
        "same data",
        "same context",
        "same materials",
        "same spatial transform"
      ],
      "method": "mutual-best-margin"
    },
    {
      "after": "object:00006",
      "before": "object:00007",
      "confidence": "strong inferred",
      "evidence": [
        "same name (not proof of identity)",
        "same geometry",
        "same topology",
        "same data",
        "same context",
        "same materials",
        "same spatial transform"
      ],
      "method": "mutual-best-margin"
    },
    {
      "after": "object:00007",
      "before": "object:00008",
      "confidence": "strong inferred",
      "evidence": [
        "same name (not proof of identity)",
        "same geometry",
        "same topology",
        "same data",
        "same context",
        "same materials",
        "same spatial transform"
      ],
      "method": "mutual-best-margin"
    },
    {
      "after": "object:00008",
      "before": "object:00009",
      "confidence": "strong inferred",
      "evidence": [
        "same name (not proof of identity)",
        "same geometry",
        "same topology",
        "same data",
        "same context",
        "same materials",
        "same spatial transform"
      ],
      "method": "mutual-best-margin"
    },
    {
      "after": "object:00009",
      "before": "object:00010",
      "confidence": "strong inferred",
      "evidence": [
        "same name (not proof of identity)",
        "same data",
        "same context",
        "same spatial transform"
      ],
      "method": "mutual-best-margin"
    },
    {
      "after": "object:00011",
      "before": "object:00012",
      "confidence": "strong inferred",
      "evidence": [
        "same name (not proof of identity)",
        "same geometry",
        "same topology",
        "same data",
        "same context",
        "same materials"
      ],
      "method": "mutual-best-margin"
    },
    {
      "after": "object:00014",
      "before": "object:00013",
      "confidence": "strong inferred",
      "evidence": [
        "same name (not proof of identity)",
        "same geometry",
        "same topology",
        "same data",
        "same context",
        "same spatial transform"
      ],
      "method": "mutual-best-margin"
    },
    {
      "after": "object:00015",
      "before": "object:00014",
      "confidence": "strong inferred",
      "evidence": [
        "same name (not proof of identity)",
        "same topology",
        "same data",
        "same context",
        "same materials",
        "same spatial transform"
      ],
      "method": "mutual-best-margin"
    }
  ],
  "coverage": {
    "compared": [
      "camera-light",
      "custom",
      "evaluated",
      "materials",
      "mesh",
      "modifiers",
      "structure",
      "transforms"
    ],
    "not_compared": [
      "UVs, vertex attributes and normals",
      "animation curves, drivers and NLA",
      "constraints settings",
      "instances, rigs, simulation caches",
      "linked resource content provenance",
      "material node graph internals and textures",
      "other scenes and view layers"
    ]
  },
  "records": [
    {
      "after": "object:00000",
      "before": "object:00000",
      "changes": [
        {
          "after": {
            "color": [
              1.0,
              1.0,
              1.0
            ],
            "energy": 1100.0,
            "size": 1.0,
            "spot_size": null,
            "type": "AREA"
          },
          "before": {
            "color": [
              1.0,
              1.0,
              1.0
            ],
            "energy": 800.0,
            "size": 1.0,
            "spot_size": null,
            "type": "AREA"
          },
          "category": "light",
          "domain": "authored",
          "label": "Light parameters"
        }
      ],
      "id": "pair:object:00000",
      "match": {
        "after": "object:00000",
        "before": "object:00000",
        "confidence": "strong inferred",
        "evidence": [
          "same name (not proof of identity)",
          "same data",
          "same context",
          "same spatial transform"
        ],
        "method": "mutual-best-margin"
      },
      "name": "Bench light",
      "status": "modified",
      "type": "blender.light"
    },
    {
      "after": "collection:00000",
      "before": "collection:00000",
      "changes": [],
      "id": "pair:collection:00000",
      "match": {
        "after": "collection:00000",
        "before": "collection:00000",
        "confidence": "strong inferred",
        "evidence": [
          "same name (not proof of identity)",
          "same context"
        ],
        "method": "mutual-best-margin"
      },
      "name": "Collection",
      "status": "unchanged",
      "type": "blender.collection"
    },
    {
      "after": "object:00001",
      "before": "object:00001",
      "changes": [
        {
          "after": [
            "Lower housing"
          ],
          "after_refs": [
            "object:00010"
          ],
          "before": [],
          "before_refs": [],
          "category": "relationship",